{
  "$schema": "https://json-schema.org/draft/2020-12/schema",
  "$id": "https://example.invalid/ses/1.0.0/conformance-result.schema.json",
  "title": "SES Conformance Result",
  "type": "object",
  "required": ["schemaVersion", "runId", "baselineId", "fixtureId", "layer", "checkId", "result", "severity", "evidence"],
  "properties": {
    "schemaVersion": { "const": "1.0.0-draft" },
    "runId": { "type": "string", "minLength": 1 },
    "baselineId": { "type": "string", "minLength": 1 },
    "fixtureId": { "type": "string", "minLength": 1 },
    "layer": { "enum": ["S", "C", "R", "A", "I", "V"] },
    "checkId": { "type": "string", "pattern": "^CHK-[A-Z0-9-]+$" },
    "result": { "enum": ["pass", "fail", "blocked", "inconclusive"] },
    "severity": { "enum": ["info", "warning", "error", "blocker"] },
    "summary": { "type": "string" },
    "failure": {
      "type": "object",
      "required": ["code", "condition"],
      "properties": {
        "code": { "type": "string", "pattern": "^ERR_[A-Z0-9_]+$" },
        "condition": { "type": "string" },
        "expected": {},
        "observed": {},
        "paths": { "type": "array", "items": { "type": "string" } }
      },
      "additionalProperties": false
    },
    "evidence": {
      "type": "object",
      "required": ["sources", "method"],
      "properties": {
        "sources": { "type": "array", "items": { "type": "string" }, "minItems": 1 },
        "method": { "type": "array", "items": { "type": "string" }, "minItems": 1 },
        "observations": { "type": "array", "items": { "type": "string" } },
        "limitations": { "type": "array", "items": { "type": "string" } }
      },
      "additionalProperties": false
    },
    "execution": {
      "type": "object",
      "properties": {
        "order": { "type": "integer", "minimum": 1 },
        "validator": { "type": "string" },
        "context": { "type": "object", "additionalProperties": true }
      },
      "additionalProperties": false
    }
  },
  "allOf": [
    { "if": { "properties": { "result": { "const": "fail" } } }, "then": { "required": ["failure"] } },
    { "if": { "properties": { "result": { "const": "blocked" } } }, "then": { "required": ["failure"] } },
    { "if": { "properties": { "result": { "const": "inconclusive" } } }, "then": { "required": ["summary"] } }
  ],
  "additionalProperties": false
}
